{
  "$schema": "https://schemas.analitiq.ai/connection/latest.json",
  "connection_id": "07070707-0707-4707-8707-070707070707",
  "connector_id": "snowflake",
  "display_name": "Snowflake \u2014 Analytics",
  "parameters": {
    "account": "acme-xy12345",
    "warehouse": "LOAD_WH",
    "database": "ANALYTICS",
    "username": "LOADER"
  },
  "secret_refs": {
    "password": "env:ANALITIQ_SNOWFLAKE_PASSWORD"
  }
}
