{
  "$schema": "https://schemas.analitiq.ai/connection/latest.json",
  "connection_id": "05050505-0505-4505-8505-050505050505",
  "connector_id": "postgresql",
  "display_name": "Production PostgreSQL",
  "parameters": {
    "host": "db.example.com",
    "port": 5432,
    "database": "analytics",
    "username": "readonly_user",
    "ssl_mode": "verify-full"
  },
  "secret_refs": {
    "password": "env:ANALITIQ_POSTGRESQL_PASSWORD",
    "ssl_ca_certificate": "env:ANALITIQ_POSTGRESQL_SSL_CA_CERTIFICATE"
  },
  "tags": [
    "production",
    "warehouse"
  ]
}
