{
  "$schema": "https://schemas.analitiq.ai/connection/latest.json",
  "connection_id": "09090909-0909-4909-8909-090909090909",
  "connector_id": "hubspot",
  "display_name": "HubSpot \u2014 Acme",
  "parameters": {
    "client_id": "acme-integration"
  },
  "secret_refs": {
    "client_secret": "env:ANALITIQ_HUBSPOT_CLIENT_SECRET"
  }
}
